{
  "reportId": "REPORT-PHASE5-PILOT-2026-02",
  "evaluationDate": "2026-09-09",
  "pilotId": "PILOT-DPS-G10-2026-02",
  "tier": "HIGH_SCHOOL",
  "verdict": "GO_TO_PHASE_6",
  "criteriaResults": [
    {
      "criterionId": "CRIT-P5-01",
      "name": "Verifiable Parental Consent (VPC)",
      "target": "100% verified parental consent",
      "actual": "100.0% (25/25)",
      "status": "PASSED"
    },
    {
      "criterionId": "CRIT-P5-02",
      "name": "Teacher Trust & Friction Signal",
      "target": "< 5.0% teacher routing around rate",
      "actual": "0.4% (3/750)",
      "status": "PASSED"
    },
    {
      "criterionId": "CRIT-P5-03",
      "name": "Pedagogical Efficacy & BKT Growth",
      "target": ">= +0.30 average mastery gain",
      "actual": "+0.58 delta P(L)",
      "status": "PASSED"
    },
    {
      "criterionId": "CRIT-P5-04",
      "name": "Child Safety Integrity",
      "target": "0 unresolved safety incidents",
      "actual": "0 incidents",
      "status": "PASSED"
    },
    {
      "criterionId": "CRIT-P5-05",
      "name": "Interactive System Latency",
      "target": "< 350ms P95 response time",
      "actual": "288.4ms",
      "status": "PASSED"
    }
  ],
  "signoffs": [
    {
      "role": "Founder & System Architect",
      "name": "Dr. Arvind Patel",
      "organization": "YOUVA-EdAi Core Leadership",
      "decision": "APPROVED",
      "date": "2026-09-09T14:00:00Z"
    },
    {
      "role": "High School Principal & Host Administrator",
      "name": "Principal Meenakshi Sundaram",
      "organization": "Delhi Public School, Sector XII, R.K. Puram",
      "decision": "APPROVED",
      "date": "2026-09-09T15:30:00Z"
    },
    {
      "role": "External Psychometric & Evaluation Lead",
      "name": "Dr. K. Ramanathan",
      "organization": "National Educational Evaluation Council",
      "decision": "APPROVED",
      "date": "2026-09-09T17:00:00Z"
    }
  ]
}
